{
  "contract_version": "1",
  "type": "inner_os_answer_completed",
  "event_id": "88888888-8888-8888-8888-888888888881",
  "meeting_id": "00000000-0000-0000-0000-000000000001",
  "query_id": "99999999-9999-9999-9999-999999999991",
  "request_id": "req-001",
  "occurred_at": "2026-08-27T08:00:15Z",
  "payload": {
    "intent": "mixed",
    "evidence": [
      {
        "segment_id": "11111111-1111-1111-1111-111111111111",
        "start_ms": 12000,
        "end_ms": 16800,
        "speaker_key": "epoch-0:speaker-0",
        "speaker_name": "张总",
        "text": "灰度阶段数据库读写延迟必须保持在 15ms 以内。",
        "content_hash": "sha256:e3b0c44298fc1c149afbf4c8996fb92427ae41e4649b934ca495991b7852b855"
      },
      {
        "segment_id": "22222222-2222-2222-2222-222222222222",
        "start_ms": 17000,
        "end_ms": 21500,
        "speaker_key": "epoch-0:speaker-1",
        "speaker_name": "王工",
        "text": "我们会增加 Redis 旁路缓存并在压测报告中单列监控指标。",
        "content_hash": "sha256:e3b0c44298fc1c149afbf4c8996fb92427ae41e4649b934ca495991b7852b855"
      }
    ],
    "facts": [
      {
        "text": "数据库读写延迟在灰度阶段必须保持在 15ms 以内。",
        "evidence_segment_ids": ["11111111-1111-1111-1111-111111111111"]
      },
      {
        "text": "王工团队负责在压测报告中单列 Redis 缓存与网关延迟指标。",
        "evidence_segment_ids": ["22222222-2222-2222-2222-222222222222"]
      }
    ],
    "judgements": [
      {
        "text": "预发验证与全量上线之间的时间窗口较为紧迫，存在压测不充分风险。",
        "basis_segment_ids": ["11111111-1111-1111-1111-111111111111"],
        "uncertainty": "medium",
        "uncertainty_reason": "会议中尚未明确压力测试的具体执行工期"
      }
    ],
    "draft": {
      "text": "关于 15ms 延迟指标，我们已在压测计划中增加专项目标。建议周四下午安排专项用例评审，以确保周五按时交付预发。"
    },
    "limitations": []
  }
}
