{
  "contract_version": "1",
  "type": "inner_os_answer_completed",
  "event_id": "88888888-8888-8888-8888-888888888882",
  "meeting_id": "00000000-0000-0000-0000-000000000001",
  "query_id": "99999999-9999-9999-9999-999999999992",
  "request_id": "req-002",
  "occurred_at": "2026-08-27T08:05:10Z",
  "payload": {
    "intent": "fact",
    "evidence": [],
    "facts": [],
    "judgements": [],
    "draft": null,
    "limitations": [
      {
        "code": "insufficient_evidence",
        "message": "在当前已确认的会议发言中，参会者尚未讨论此项内容。"
      }
    ]
  }
}
